{"$schema":"https://json-schema.org/draft/2020-12/schema","$id":"https://novel-production-os.local/schemas/soft-threshold-selection.v1.schema.json","type":"object","additionalProperties":false,"required":["schema_version","samples_hash","labels_hash","split_hash","features_hash","extractor_id","extractor_version","selection_policy","calibrated_at","expires_at","owner","selections","selection_hash","holdout_used","thresholds","bundle_hash"],"properties":{"schema_version":{"const":"soft-threshold-selection.v1"},"samples_hash":{"$ref":"#/$defs/hash"},"labels_hash":{"$ref":"#/$defs/hash"},"split_hash":{"$ref":"#/$defs/hash"},"features_hash":{"$ref":"#/$defs/hash"},"extractor_id":{"const":"soft_feature_extractor"},"extractor_version":{"const":"v1"},"selection_policy":{"const":"train-candidates-calibration-then-train-balanced-accuracy-v1"},"calibrated_at":{"type":"string"},"expires_at":{"type":"string"},"owner":{"type":"string"},"selections":{"type":"array","minItems":3,"maxItems":3,"items":{"$ref":"#/$defs/selection"}},"selection_hash":{"$ref":"#/$defs/hash"},"holdout_used":{"const":false},"thresholds":{"type":"array","minItems":3,"maxItems":3,"items":{"type":"object","additionalProperties":false,"required":["detector_id","threshold"],"properties":{"detector_id":{"enum":["persona_drift","trope_repeat","word_count_cheat"]},"threshold":{"$ref":"calibrated-threshold.v1.schema.json"}}}},"bundle_hash":{"$ref":"#/$defs/hash"}},"$defs":{"hash":{"type":"string","pattern":"^sha256:[0-9a-f]{64}$"},"metrics":{"type":"object","additionalProperties":false,"required":["tp","fp","tn","fn","precision","recall","balanced_accuracy"],"properties":{"tp":{"type":"integer"},"fp":{"type":"integer"},"tn":{"type":"integer"},"fn":{"type":"integer"},"precision":{"type":["number","null"]},"recall":{"type":["number","null"]},"balanced_accuracy":{"type":["number","null"]}}},"distribution":{"type":"object","additionalProperties":false,"required":["p50","p90","p99"],"properties":{"p50":{"type":"number"},"p90":{"type":"number"},"p99":{"type":"number"}}},"selection":{"type":"object","additionalProperties":false,"required":["detector_id","metric","direction","threshold","candidate_count","train_sample_count","calibration_sample_count","train_metrics","calibration_metrics","distribution"],"properties":{"detector_id":{"enum":["persona_drift","trope_repeat","word_count_cheat"]},"metric":{"type":"string"},"direction":{"const":">="},"threshold":{"type":"number"},"candidate_count":{"type":"integer"},"train_sample_count":{"const":12},"calibration_sample_count":{"const":10},"train_metrics":{"$ref":"#/$defs/metrics"},"calibration_metrics":{"$ref":"#/$defs/metrics"},"distribution":{"$ref":"#/$defs/distribution"}}}}}