{"bundle_hash":"sha256:c7f35608853f6a784df4ddf59e2c7b01449e4f23e2829e67650b55a1aee0963e","calibrated_at":"2026-09-29T00:00:00+00:00","expires_at":"2026-12-29T00:00:00+00:00","extractor_id":"soft_feature_extractor","extractor_version":"v1","features_hash":"sha256:b724b35c1dfb321f44718ad01373b1c6117374af32f26ea3e5dbd4b2679f1aa6","holdout_used":false,"labels_hash":"sha256:d8b334b898fd2b42392169da1ce450367e2a8b3a24d096e1964a529d9d969ce0","owner":"quality","samples_hash":"sha256:99bf401f166aeee492eec7814c12446b365eacc62ac68a9b30f4329f5bce37b7","schema_version":"soft-threshold-selection.v1","selection_hash":"sha256:0d1ce7557293a5ab037fe77d66ed75d71c0bffb65d2db24a9023b92e513ef8c9","selection_policy":"train-candidates-calibration-then-train-balanced-accuracy-v1","selections":[{"calibration_metrics":{"balanced_accuracy":1.0,"fn":0,"fp":0,"precision":1.0,"recall":1.0,"tn":5,"tp":5},"calibration_sample_count":10,"candidate_count":3,"detector_id":"persona_drift","direction":">=","distribution":{"p50":0.0,"p90":1.0,"p99":1.0},"metric":"persona_baseline_mismatch","threshold":1.0,"train_metrics":{"balanced_accuracy":1.0,"fn":0,"fp":0,"precision":1.0,"recall":1.0,"tn":6,"tp":6},"train_sample_count":12},{"calibration_metrics":{"balanced_accuracy":1.0,"fn":0,"fp":0,"precision":1.0,"recall":1.0,"tn":5,"tp":5},"calibration_sample_count":10,"candidate_count":11,"detector_id":"trope_repeat","direction":">=","distribution":{"p50":0.0,"p90":5.0,"p99":6.0},"metric":"repeated_sentence_excess","threshold":2.0,"train_metrics":{"balanced_accuracy":1.0,"fn":0,"fp":0,"precision":1.0,"recall":1.0,"tn":6,"tp":6},"train_sample_count":12},{"calibration_metrics":{"balanced_accuracy":1.0,"fn":0,"fp":0,"precision":1.0,"recall":1.0,"tn":5,"tp":5},"calibration_sample_count":10,"candidate_count":13,"detector_id":"word_count_cheat","direction":">=","distribution":{"p50":0.0,"p90":0.6140350877192983,"p99":0.6166666666666667},"metric":"filler_character_ratio","threshold":0.5915492957746479,"train_metrics":{"balanced_accuracy":1.0,"fn":0,"fp":0,"precision":1.0,"recall":1.0,"tn":6,"tp":6},"train_sample_count":12}],"split_hash":"sha256:faa81c9a56c613b4bd9da57f089d1bf68c9e5637b104023af52e2aec3f8b7729","thresholds":[{"detector_id":"persona_drift","threshold":{"calibrated_at":"2026-09-29T00:00:00+00:00","calibration_report_hash":"sha256:0d1ce7557293a5ab037fe77d66ed75d71c0bffb65d2db24a9023b92e513ef8c9","corpus_hash":"sha256:99bf401f166aeee492eec7814c12446b365eacc62ac68a9b30f4329f5bce37b7","distribution":{"p50":0.0,"p90":1.0,"p99":1.0},"expires_at":"2026-12-29T00:00:00+00:00","metric":"persona_baseline_mismatch","owner":"quality","rationale":"persona_drift train candidates selected on frozen calibration split","sample_size":22,"schema_version":"calibrated-threshold.v1","severity":"warning","value":1.0}},{"detector_id":"trope_repeat","threshold":{"calibrated_at":"2026-09-29T00:00:00+00:00","calibration_report_hash":"sha256:0d1ce7557293a5ab037fe77d66ed75d71c0bffb65d2db24a9023b92e513ef8c9","corpus_hash":"sha256:99bf401f166aeee492eec7814c12446b365eacc62ac68a9b30f4329f5bce37b7","distribution":{"p50":0.0,"p90":5.0,"p99":6.0},"expires_at":"2026-12-29T00:00:00+00:00","metric":"repeated_sentence_excess","owner":"quality","rationale":"trope_repeat train candidates selected on frozen calibration split","sample_size":22,"schema_version":"calibrated-threshold.v1","severity":"warning","value":2.0}},{"detector_id":"word_count_cheat","threshold":{"calibrated_at":"2026-09-29T00:00:00+00:00","calibration_report_hash":"sha256:0d1ce7557293a5ab037fe77d66ed75d71c0bffb65d2db24a9023b92e513ef8c9","corpus_hash":"sha256:99bf401f166aeee492eec7814c12446b365eacc62ac68a9b30f4329f5bce37b7","distribution":{"p50":0.0,"p90":0.6140350877192983,"p99":0.6166666666666667},"expires_at":"2026-12-29T00:00:00+00:00","metric":"filler_character_ratio","owner":"quality","rationale":"word_count_cheat train candidates selected on frozen calibration split","sample_size":22,"schema_version":"calibrated-threshold.v1","severity":"warning","value":0.5915492957746479}}]}